{"checksum":"sha256:a82ecbcb48ed87d3861f263a629aec5256c1d6211d3a15207db9fbaf1c6fa4f8","entries":[{"effective_at":1700000000,"expires_at":0,"kind":"certificate_fingerprint","reason":"credential compromise","revoked_at":1700000000,"value":"sha256:aaaaaaaaaaaaaaaaaaaaaaaaaaaaaaaaaaaaaaaaaaaaaaaaaaaaaaaaaaaaaaaa"},{"effective_at":2000000000,"expires_at":2100000000,"kind":"peer_id","reason":"scheduled isolation","revoked_at":1900000000,"value":"peer-b"},{"effective_at":1700000001,"expires_at":0,"kind":"signer_fingerprint","reason":"signing key compromise","revoked_at":1700000001,"value":"sha256:bbbbbbbbbbbbbbbbbbbbbbbbbbbbbbbbbbbbbbbbbbbbbbbbbbbbbbbbbbbbbbbb"}],"format":"handoffkit.security.revocations","format_version":1,"generation":3}
